{
  "MetaModelInfo": {
    "modelname": "Test model",
    "targetenvironment": "test infomodel",
    "modelversion": "0.1",
    "modeltype": "Meta model"
  },
  "Models": [{
    "Informationsmodell": {
      "ModelInfo": {
        "modelname": "Informationsmodell",
        "targetenvironment": "information model standard",
        "modelversion": "0.1",
        "modeltype": "Information model"
      }
    }
  }],
  "Derivations": [],
  "Mappings": [],
  "Transformations": []
}
